title,category,author,date,replies,content,url,scraped_at
Permanently Closed Marketplace Sales Thread,The Marketplace,we1,"Apr 20, 2020",3300,Sales Thread Update This sales thread has been permanently closed! Original sales content and contact information have been removed to protect our members and maintain the quality of the Marketplace. Click here to find active and tested Proxy services! Check out our Marketplace Rules if you wish to become a seller in our Marketplace.​,https://www.blackhatworld.com/seo/permanently-closed-marketplace-sales-thread.1544327/,2026-06-28T13:42:49.068647
My journey - Desirable1,BlackHatWorld,desirable1,"Mar 26, 2026",1,"Greetings i would like to introduce myself with my nick name Desirable1. based in Delhi, India. i look forward to accure knowledge, that is learn as well as earn in this industry and make a good network of friends in the industry. thanks hope to have a good journey here and accomplish my goal of learn and earn.",https://www.blackhatworld.com/seo/my-journey-desirable1.1803561/,2026-06-28T13:42:57.355645
Permanently Closed Marketplace Sales Thread,The Marketplace,yenerich,"May 26, 2013",1322,Sales Thread Update This sales thread has been permanently closed! Original sales content and contact information have been removed to protect our members and maintain the quality of the Marketplace. Click here to find active and tested Content / Copywriting services! Check out our Marketplace Rules if you wish to become a seller in our Marketplace.​,https://www.blackhatworld.com/seo/permanently-closed-marketplace-sales-thread.707712/,2026-06-28T13:43:06.794416
Fix linkedin issues,Social Media,Srabon888,"Dec 7, 2016",621,"Read carefully to being prevent linkedin locked or suspende I recommend logging into LinkedIn using a reliable proxy, preferably a 5G mobile proxy like T-Mobile or AT&T. The choice of proxy is crucial for LinkedIn, and using the right one can make your LinkedIn experience smoother. For example, I suggest using an AT&T proxy. Also, make sure to use a good browser; you can opt for Firefox or an Antidetect browser. However, not all Antidetect browsers are effective, as LinkedIn can detect some of them. Once you have the right proxy and browser, log in to LinkedIn and take it slow. Avoid spamming early on; instead, give it one or two days before logging out. After that, log back in, and it's essential to log in with your LinkedIn email address. Keep an eye on any emails from LinkedIn, especially those regarding suspicious login activity. Always open these emails as LinkedIn tracks your interaction with them. Failing to open these emails might trigger suspicions of unauthorized account use, potentially leading to an account suspension. Additionally, refrain from excessive likes, comments, or connection requests. Instead, spend time scrolling, reading, and building a trust score before engaging in more active interactions. Following these steps should help prevent your account from being locked or suspended. Let me know if you have any questions or need further assistance!",https://www.blackhatworld.com/seo/fix-linkedin-issues.1565032/,2026-06-28T13:43:15.469578
Google update in month of September,Black Hat SEO,seomaster5,"Oct 31, 2021",5162,Is there any Google update in month of september ? Is anyone noticing sharp decline in traffic recently ?,https://www.blackhatworld.com/seo/google-update-in-month-of-september.1755233/,2026-06-28T13:43:23.522162
"⭐ MOON AGENCY ⭐ FACEBOOK AD ACCOUNT RENTAL SERVICE ✔️ ALL RUN GAMBLING , CRYPTO ,NUTRA ... ✔️ Service Fee 4-8% ALL PRODUCTS ,SUPPORT ✔️",The Marketplace,Moon Marketing Agency,"Jun 23, 2024",744,"WELCOME TO MOON AGENCY MARKETING Quality Facebook advertising account rental service with only 8% to start - always reserve a stable number of >500 accounts with spending history ( Accept BH, WH, GH : Gambling , Crypto , App , NFT, Finance..... ), Support campaign optimization for customers - 24/7 Support. ____________________________________________________________________________ 1, Service details : - Strong and stable ads accounts - bring optimization and quality to customers; - Ad account daily spending limit from 250 – unlimited ( quantity is always stable ); - Stable payment card; - Use healthy profiles and pages ( Support renaming ); - Working Platform: Adspower, VPS, Dolphin ,..... (proxy quality : healthy, fast ); - Cloak link to use at no cost; - Provide and support creating pixels suitable for des;ired customer events; - Moon Agency guarantees the safety of accounts after providing them to customers; - 24/7 technical consulting support 2, Advertising account rental fee : - Spend < $1.000/Day : 8% - Spend $1.000 => $3.000/Day : 7% - Spend $3.000 => $5.000/Day : 6% - Spend $5.000 => $10.000/Day : 5% - Spend $10.000++/Day : NEGOTIATE GIFT FROM MOON AGENCY : REDUCE 1% FEES FOR CLIENT FROM BHW TO START WITH BUDGET OF OVER $1.000 PER DAY. 3, Payment methods : * USDT TRC20 : THxeDh5zJ1ERoaAnpzDpoKaainfNS9YHFi * ERC : 0x2E11825E0BBB0B8da9bf3EAf7De5B208535Ce1e8 4, Refund policy : - Commitment to refund 100% of the remaining balance if the customer has a problem and wants to stop cooperating. (takes place within 1 day and is agreed by both parties). 5, Contact via : * Telegram : t.me/MoonAgency202 t.me/Lavie_MoonAgency 6, Check Out Website : https://moonagency.shop/ WE ARE HAPPY TO SUPPORT ALL CUSTOMERS !!​",https://www.blackhatworld.com/seo/moon-agency-facebook-ad-account-rental-service-all-run-gambling-crypto-nutra-service-fee-4-8-all-products-support.1630316/,2026-06-28T13:43:35.702865
"⭐⚡ POWERFUL 301 REDIRECT BACKLINKS FROM TOP SITES ✅ FORBES NYTIMES, BBC ✅⚡ THE SECRET WEAPON FOR EXPLOSIVE TRAFFIC & RANKINGS⚡⭐",The Marketplace,Blink SEO,"Aug 5, 2024",1548,"Refund Policy​If any redirect is not live at the time of delivery, we will refund it No refunds once links are delivered Send your target URL(s) I’ll handle the rest — with full transparency and on-time delivery Place The Order TELEGRAM : BLINKSEOAGENCY EMAIL : Bulletseo71@gmail.com ​",https://www.blackhatworld.com/seo/powerful-301-redirect-backlinks-from-top-sites-forbes-nytimes-bbc-the-secret-weapon-for-explosive-traffic-rankings.1738107/,2026-06-28T13:43:44.346710
Why do most high-achievers avoid entrepreneurship?,Black Hat SEO,megakim,"Feb 27, 2025",295,"I’ve known a lot of people way smarter than me like engineers, analysts, strategy people, who never even consider starting their own thing. Supposedly, only about 0.1% of highly talented people go the entrepreneurship route. I’m no genius myself, but I do run a SaaS, and it’s wild to me how much brainpower sits on the sidelines. After meeting hundreds of high-potential people in corporate and tech, I think it’s less about money or ideas and more about comfort. Smart people often build stable, well-paid careers, and the thought of ditching that certainty for the chaos of entrepreneurship is just not appealing. Also, there’s the curse of seeing too many risks. Being able to see every possible way something could go wrong can paralyze you before you ever start. When I started my business SocLeads, there were at least ten voices in my head telling me why it would fail and none telling me to just try it and learn. Most people don’t need more brains or better ideas, they need permission to try, get things wrong, and not have it wreck their self-image. I really believe talent is everywhere, but momentum is rare. Sometimes average people win just because they’re willing to send that first cold email, launch an early version, or risk looking dumb.",https://www.blackhatworld.com/seo/why-do-most-high-achievers-avoid-entrepreneurship.1814986/,2026-06-28T13:43:53.926863
Permanently Closed Marketplace Sales Thread,The Marketplace,solidguy_82,"Jul 14, 2016",2899,Sales Thread Update This sales thread has been permanently closed! Original sales content and contact information have been removed to protect our members and maintain the quality of the Marketplace. https://www.blackhatworld.com/forums/seo-packages.206/ Check out our https://www.blackhatworld.com/forums/bhw-marketplace-rules-and-how-to-post.203/ if you wish to become a seller in our Marketplace.​,https://www.blackhatworld.com/seo/permanently-closed-marketplace-sales-thread.1495928/,2026-06-28T13:44:03.647982
██████GUARANTEED TRAFFIC ███████ Autoblogging Sites [Adsense + Amazon + Clickbank] ⏩ Monthly Articles Auto Updated ⏩ 50% OFF LIMITED SLOTS,The Marketplace,Sofiamartinez,"Mar 3, 2017",5571,"For 50% OFF Reply To Thread ""I Want 50% OFF"" - Limited Slots Only ​",https://www.blackhatworld.com/seo/guaranteed-traffic-autoblogging-sites-adsense-amazon-clickbank-monthly-articles-auto-updated-50-off-limited-slots.1339488/,2026-06-28T13:44:12.631987
expired domains seo works in 2026?,Black Hat SEO,User7,"Jun 4, 2017",75,i read that google update policy to not include ranking for expired domain spam your experience in 2026?,https://www.blackhatworld.com/seo/expired-domains-seo-works-in-2026.1789838/,2026-06-28T13:44:21.814548
attract customers,Social Media,Dat2068,"Sep 8, 2025",199,What is the safest way to attract new customers in 2025 without wasting advertising costs?,https://www.blackhatworld.com/seo/attract-customers.1767363/,2026-06-28T13:45:02.609240
How do you know when an SEO strategy is actually working?,White Hat SEO,SEORCE,"Jun 23, 2026",5,"SEO results usually take time, so it can be diffuicult to know whether you're moving in the right direction. What early signs do you look for before rankings and traffic start improving?",https://www.blackhatworld.com/seo/how-do-you-know-when-an-seo-strategy-is-actually-working.1827351/,2026-06-28T13:45:11.471365
Manufactured UGC on my own forum site to rank,Black Hat SEO,ryanster1999,"Dec 23, 2024",2,"Hey guys, I’m in the casino affiliate niche and run an established community along with a Discourse forum. I’ve been experimenting by creating threads and replies in my own forum copying long tail queries from Ahrefs and have seen some interesting results. For example, I’ll look up questions in Ahrefs and find queries like “Is Zula Casino instant payout?” Then I’ll create that exact question as a thread on my forum. Later I’ll reply from another account with something like, “No, it’s not instant. It usually takes around 3 to 5 days. If you’re looking for casinos with instant payouts you can check out this list here: [link].” Doing this, I’ve managed to rank for about half a dozen long tail questions already. I should also mention that the forum does have real engagement, so these test threads are mixed in with organic discussions from actual members. My question is whether this is safe to scale up, or if Google would eventually figure out that I’m seeding some of these discussions myself and tank the whole site. For example, if I started creating a lot more of these Q&A style threads targeting specific long tail searches, then replying and subtlety linking in my pillar posts. Is that a good idea or could it backfire from an SEO standpoint? Curious if anyone here has experience with this. Thanks in advance. Cheers!!",https://www.blackhatworld.com/seo/manufactured-ugc-on-my-own-forum-site-to-rank.1800270/,2026-06-28T13:45:20.066599
Accounts implementation,Social Media,Phoenix13311,"Jan 18, 2025",1,"Hello, everyone! I would like to sell my Reddit accounts, which I farm myself. How can I do this? Can anyone advise me on the best price to set? On which platforms should I sell them, and where can I find buyers?",https://www.blackhatworld.com/seo/accounts-implementation.1757520/,2026-06-28T13:45:28.628590
⭐️ ⭐️ ⭐️ ⭐️ ⭐️ SEO Packages ⭐️Manually Local SEO + Backlinks⭐️ Google Algorithm Friendly⭐️ Boost Rankings & Branding⭐️SEOBagpack,The Marketplace,S4Sunny,"Aug 28, 2019",789,"200 Mixed Platform Backlinks with (Unique, Quality & SEO-friendly Content) Reports: Provide you proper backlinks report ASAP After the links are posted NICHE Any Niche is accepted - Except: Adult, Casino - We had separate packages for these categories What you will get? Articles Local Listing (Major Listings if client provides OTP (business verification codes) Docs Submission Blogs Profile creations Podcast Listings Bookmarking Classifieds Blog commenting (LIVE) Bogus Events (Webinars) Complimentary Backlinks Articles: 500 WC Each unique Content Blogs: 300 WC Each Unique Content Note: All the links will be generated manually and 100% result oriented With High DA/PA/TF Work For single website with 4-5 URL's Targeting 4-5 targeting Keywords Major Local listings like 'YELP', Can be listed only when client provides OTP (Verification codes) Refund: You will get a refund if we delayed delivering your order. Skype: sscahead Email: info@seobagpack.com ​",https://www.blackhatworld.com/seo/seo-packages-manually-local-seo-backlinks-google-algorithm-friendly-boost-rankings-branding-seobagpack.1530323/,2026-06-28T13:45:37.706139
